{
  "queue_id": "queue-example-1",
  "status": "pending",
  "attempt_count": 0,
  "next_attempt_at_ms": 1783770000000,
  "created_at_ms": 1783770000000,
  "updated_at_ms": 1783770000000,
  "event": {
    "event_id": "example-install:movie:provider-123:progress:percent-42",
    "event_type": "progress",
    "media_type": "movie",
    "timestamp_ms": 1783770000000,
    "position_ms": 3180000,
    "duration_ms": 7500000,
    "progress_percent": 42.4,
    "title": "Example Movie",
    "show_title": null,
    "year": 2024,
    "season": null,
    "episode": null,
    "provider_item_id": "provider-123",
    "provider_playlist_id": "playlist-1",
    "ids": {
      "trakt": null,
      "tmdb": null,
      "tvdb": null,
      "imdb": null
    },
    "source": "tivimate-runtime-hook",
    "raw_hook": null
  },
  "last_error": null,
  "last_http_status": null,
  "trakt_response": null
}
